[
  {
    "id": "L001",
    "unit": 1,
    "order": 1,
    "title": "Greetings & introducing yourself",
    "cefr": "A1",
    "objectives": [
      "Understand & use key phrases about: Greetings & introducing yourself.",
      "Complete 5-min micro lessons with typing + listening."
    ],
    "exercise_plan": [
      "mcq",
      "match",
      "word_order",
      "typing",
      "listening"
    ],
    "unlock": {
      "requires_lesson_ids": []
    }
  },
  {
    "id": "L002",
    "unit": 1,
    "order": 2,
    "title": "Pronouns & 'to be'",
    "cefr": "A1",
    "objectives": [
      "Understand & use key phrases about: Pronouns & 'to be'.",
      "Complete 5-min micro lessons with typing + listening."
    ],
    "exercise_plan": [
      "mcq",
      "match",
      "word_order",
      "typing",
      "listening"
    ],
    "unlock": {
      "requires_lesson_ids": [
        "L001"
      ]
    }
  },
  {
    "id": "L003",
    "unit": 1,
    "order": 3,
    "title": "Numbers & time",
    "cefr": "A1",
    "objectives": [
      "Understand & use key phrases about: Numbers & time.",
      "Complete 5-min micro lessons with typing + listening."
    ],
    "exercise_plan": [
      "mcq",
      "match",
      "word_order",
      "typing",
      "listening"
    ],
    "unlock": {
      "requires_lesson_ids": [
        "L002"
      ]
    }
  },
  {
    "id": "L004",
    "unit": 1,
    "order": 4,
    "title": "Coffee & ordering",
    "cefr": "A1",
    "objectives": [
      "Understand & use key phrases about: Coffee & ordering.",
      "Complete 5-min micro lessons with typing + listening."
    ],
    "exercise_plan": [
      "mcq",
      "match",
      "word_order",
      "typing",
      "listening"
    ],
    "unlock": {
      "requires_lesson_ids": [
        "L003"
      ]
    }
  },
  {
    "id": "L005",
    "unit": 1,
    "order": 5,
    "title": "Family & people",
    "cefr": "A1",
    "objectives": [
      "Understand & use key phrases about: Family & people.",
      "Complete 5-min micro lessons with typing + listening."
    ],
    "exercise_plan": [
      "mcq",
      "match",
      "word_order",
      "typing",
      "listening"
    ],
    "unlock": {
      "requires_lesson_ids": [
        "L004"
      ]
    }
  },
  {
    "id": "L006",
    "unit": 1,
    "order": 6,
    "title": "Food & shopping",
    "cefr": "A1",
    "objectives": [
      "Understand & use key phrases about: Food & shopping.",
      "Complete 5-min micro lessons with typing + listening."
    ],
    "exercise_plan": [
      "mcq",
      "match",
      "word_order",
      "typing",
      "listening"
    ],
    "unlock": {
      "requires_lesson_ids": [
        "L005"
      ]
    }
  },
  {
    "id": "L007",
    "unit": 1,
    "order": 7,
    "title": "Directions",
    "cefr": "A1",
    "objectives": [
      "Understand & use key phrases about: Directions.",
      "Complete 5-min micro lessons with typing + listening."
    ],
    "exercise_plan": [
      "mcq",
      "match",
      "word_order",
      "typing",
      "listening"
    ],
    "unlock": {
      "requires_lesson_ids": [
        "L006"
      ]
    }
  },
  {
    "id": "L008",
    "unit": 1,
    "order": 8,
    "title": "Home & daily routine",
    "cefr": "A1",
    "objectives": [
      "Understand & use key phrases about: Home & daily routine.",
      "Complete 5-min micro lessons with typing + listening."
    ],
    "exercise_plan": [
      "mcq",
      "match",
      "word_order",
      "typing",
      "listening"
    ],
    "unlock": {
      "requires_lesson_ids": [
        "L007"
      ]
    }
  },
  {
    "id": "L009",
    "unit": 1,
    "order": 9,
    "title": "Weather & seasons",
    "cefr": "A1",
    "objectives": [
      "Understand & use key phrases about: Weather & seasons.",
      "Complete 5-min micro lessons with typing + listening."
    ],
    "exercise_plan": [
      "mcq",
      "match",
      "word_order",
      "typing",
      "listening"
    ],
    "unlock": {
      "requires_lesson_ids": [
        "L008"
      ]
    }
  },
  {
    "id": "L010",
    "unit": 1,
    "order": 10,
    "title": "Simple past intro (high level)",
    "cefr": "A1",
    "objectives": [
      "Understand & use key phrases about: Simple past intro (high level).",
      "Complete 5-min micro lessons with typing + listening."
    ],
    "exercise_plan": [
      "mcq",
      "match",
      "word_order",
      "typing",
      "listening"
    ],
    "unlock": {
      "requires_lesson_ids": [
        "L009"
      ]
    }
  },
  {
    "id": "L011",
    "unit": 2,
    "order": 1,
    "title": "Work & study",
    "cefr": "A1",
    "objectives": [
      "Understand & use key phrases about: Work & study.",
      "Complete 5-min micro lessons with typing + listening."
    ],
    "exercise_plan": [
      "mcq",
      "match",
      "word_order",
      "typing",
      "listening"
    ],
    "unlock": {
      "requires_lesson_ids": [
        "L010"
      ]
    }
  },
  {
    "id": "L012",
    "unit": 2,
    "order": 2,
    "title": "Transport",
    "cefr": "A1",
    "objectives": [
      "Understand & use key phrases about: Transport.",
      "Complete 5-min micro lessons with typing + listening."
    ],
    "exercise_plan": [
      "mcq",
      "match",
      "word_order",
      "typing",
      "listening"
    ],
    "unlock": {
      "requires_lesson_ids": [
        "L011"
      ]
    }
  },
  {
    "id": "L013",
    "unit": 2,
    "order": 3,
    "title": "Health basics",
    "cefr": "A1",
    "objectives": [
      "Understand & use key phrases about: Health basics.",
      "Complete 5-min micro lessons with typing + listening."
    ],
    "exercise_plan": [
      "mcq",
      "match",
      "word_order",
      "typing",
      "listening"
    ],
    "unlock": {
      "requires_lesson_ids": [
        "L012"
      ]
    }
  },
  {
    "id": "L014",
    "unit": 2,
    "order": 4,
    "title": "At the market",
    "cefr": "A1",
    "objectives": [
      "Understand & use key phrases about: At the market.",
      "Complete 5-min micro lessons with typing + listening."
    ],
    "exercise_plan": [
      "mcq",
      "match",
      "word_order",
      "typing",
      "listening"
    ],
    "unlock": {
      "requires_lesson_ids": [
        "L013"
      ]
    }
  },
  {
    "id": "L015",
    "unit": 2,
    "order": 5,
    "title": "Hobbies",
    "cefr": "A1",
    "objectives": [
      "Understand & use key phrases about: Hobbies.",
      "Complete 5-min micro lessons with typing + listening."
    ],
    "exercise_plan": [
      "mcq",
      "match",
      "word_order",
      "typing",
      "listening"
    ],
    "unlock": {
      "requires_lesson_ids": [
        "L014"
      ]
    }
  },
  {
    "id": "L016",
    "unit": 2,
    "order": 6,
    "title": "Plans (future with 'do')",
    "cefr": "A1",
    "objectives": [
      "Understand & use key phrases about: Plans (future with 'do').",
      "Complete 5-min micro lessons with typing + listening."
    ],
    "exercise_plan": [
      "mcq",
      "match",
      "word_order",
      "typing",
      "listening"
    ],
    "unlock": {
      "requires_lesson_ids": [
        "L015"
      ]
    }
  },
  {
    "id": "L017",
    "unit": 2,
    "order": 7,
    "title": "Questions & negation",
    "cefr": "A1",
    "objectives": [
      "Understand & use key phrases about: Questions & negation.",
      "Complete 5-min micro lessons with typing + listening."
    ],
    "exercise_plan": [
      "mcq",
      "match",
      "word_order",
      "typing",
      "listening"
    ],
    "unlock": {
      "requires_lesson_ids": [
        "L016"
      ]
    }
  },
  {
    "id": "L018",
    "unit": 2,
    "order": 8,
    "title": "Places in town",
    "cefr": "A1",
    "objectives": [
      "Understand & use key phrases about: Places in town.",
      "Complete 5-min micro lessons with typing + listening."
    ],
    "exercise_plan": [
      "mcq",
      "match",
      "word_order",
      "typing",
      "listening"
    ],
    "unlock": {
      "requires_lesson_ids": [
        "L017"
      ]
    }
  },
  {
    "id": "L019",
    "unit": 2,
    "order": 9,
    "title": "Phone & messages",
    "cefr": "A1",
    "objectives": [
      "Understand & use key phrases about: Phone & messages.",
      "Complete 5-min micro lessons with typing + listening."
    ],
    "exercise_plan": [
      "mcq",
      "match",
      "word_order",
      "typing",
      "listening"
    ],
    "unlock": {
      "requires_lesson_ids": [
        "L018"
      ]
    }
  },
  {
    "id": "L020",
    "unit": 2,
    "order": 10,
    "title": "Review / checkpoint",
    "cefr": "A1",
    "objectives": [
      "Understand & use key phrases about: Review / checkpoint.",
      "Complete 5-min micro lessons with typing + listening."
    ],
    "exercise_plan": [
      "mcq",
      "match",
      "word_order",
      "typing",
      "listening"
    ],
    "unlock": {
      "requires_lesson_ids": [
        "L019"
      ]
    }
  },
  {
    "id": "L021",
    "unit": 3,
    "order": 1,
    "title": "Describe people",
    "cefr": "A1",
    "objectives": [
      "Understand & use key phrases about: Describe people.",
      "Complete 5-min micro lessons with typing + listening."
    ],
    "exercise_plan": [
      "mcq",
      "match",
      "word_order",
      "typing",
      "listening"
    ],
    "unlock": {
      "requires_lesson_ids": [
        "L020"
      ]
    }
  },
  {
    "id": "L022",
    "unit": 3,
    "order": 2,
    "title": "Adjectives agreement (intro)",
    "cefr": "A1",
    "objectives": [
      "Understand & use key phrases about: Adjectives agreement (intro).",
      "Complete 5-min micro lessons with typing + listening."
    ],
    "exercise_plan": [
      "mcq",
      "match",
      "word_order",
      "typing",
      "listening"
    ],
    "unlock": {
      "requires_lesson_ids": [
        "L021"
      ]
    }
  },
  {
    "id": "L023",
    "unit": 3,
    "order": 3,
    "title": "Possession",